{
  "id": "2e3f4a5b-6c7d-4e8f-9a0b-1c2d3e4f5a6b",
  "type": "energy.trade.executed",
  "source": "commerce-api",
  "time": "2025-01-14T11:20:00Z",
  "data": {
    "trade_id": "d2e3f4a5-6b7c-4d8e-9f0a-1b2c3d4e5f6a",
    "kind": "h2_sale",
    "quantity_kg": 250.0,
    "price_minor": 225000,
    "executed_at": "2025-01-14T11:19:58Z"
  }
}
